{
  "name": "Turmeric",
  "slug": "turmeric",
  "book_claims": [
    {
      "claim": "Curcumin reduces chronic low-grade inflammation by inhibiting the NF-kB signaling pathway",
      "mechanism": "Curcumin blocks IkB kinase, preventing NF-kB translocation to the nucleus and subsequent transcription of pro-inflammatory cytokines (TNF-alpha, IL-6, IL-1beta)",
      "study_ref": "Aggarwal BB, Harikumar KB. Int J Biochem Cell Biol. 2009;41(1):40-59",
      "confidence": "high"
    },
    {
      "claim": "Regular turmeric consumption is associated with lower rates of Alzheimer's disease in populations with high dietary intake",
      "mechanism": "Curcumin crosses the blood-brain barrier and reduces amyloid-beta plaque accumulation",
      "study_ref": "Mishra S, Palanivelu K. Ann Indian Acad Neurol. 2008;11(1):13-19",
      "confidence": "medium"
    },
    {
      "claim": "Curcumin bioavailability increases up to 2000% when consumed with piperine from black pepper",
      "mechanism": "Piperine inhibits hepatic and intestinal glucuronidation of curcumin",
      "study_ref": "Shoba G et al. Planta Med. 1998;64(4):353-356",
      "confidence": "high"
    }
  ],
  "supplementary_research": [
    {
      "source": "Examine",
      "url": "https://examine.com/supplements/curcumin/",
      "finding": "Curcumin has strong evidence for reducing inflammatory markers (CRP, IL-6) and moderate evidence for joint pain relief comparable to NSAIDs in some trials",
      "agrees_with_book": true
    },
    {
      "source": "PubMed",
      "url": "https://pubmed.ncbi.nlm.nih.gov/29065496/",
      "finding": "Meta-analysis of 8 RCTs: curcumin supplementation significantly reduced serum CRP levels (weighted mean difference: -2.20 mg/L, 95% CI: -3.96 to -0.44)",
      "agrees_with_book": true
    },
    {
      "source": "PubMed",
      "url": "https://pubmed.ncbi.nlm.nih.gov/31279955/",
      "finding": "Systematic review found limited evidence for curcumin in Alzheimer's prevention in humans, despite promising animal studies. More large-scale RCTs needed.",
      "agrees_with_book": false
    }
  ],
  "flavor_profile": {
    "taste": ["bitter", "slightly peppery", "warm", "earthy"],
    "aroma": ["musky", "slightly ginger-like", "peppery"],
    "texture": ["powdery when ground", "fibrous when fresh"],
    "culinary_category": "spice"
  },
  "culinary_pairings": [
    {
      "ingredient": "black pepper",
      "tradition": "Indian",
      "source": "Traditional Ayurvedic combination (trikatu)"
    },
    {
      "ingredient": "coconut milk",
      "tradition": "Southeast Asian",
      "source": "Thai and Indonesian curry traditions"
    },
    {
      "ingredient": "chickpeas",
      "tradition": "Indian",
      "source": "Madhur Jaffrey, Indian Cooking"
    },
    {
      "ingredient": "cauliflower",
      "tradition": "Indian",
      "source": "Aloo gobi tradition, Yotam Ottolenghi, Plenty"
    },
    {
      "ingredient": "honey",
      "tradition": "Ayurvedic",
      "source": "Golden milk (haldi doodh) tradition"
    }
  ],
  "seasonality": "Year-round (dried); fresh root peaks autumn through spring",
  "nutrient_highlights": [
    {
      "compound": "Curcumin (curcuminoids)",
      "amount_per_100g": "~3.14g in turmeric powder",
      "bioavailability_notes": "Poorly absorbed alone (<1%). Requires piperine (20x boost) and/or fat for meaningful absorption."
    },
    {
      "compound": "Manganese",
      "amount_per_100g": "19.8mg (860% DV)",
      "bioavailability_notes": "Well absorbed from turmeric"
    },
    {
      "compound": "Iron",
      "amount_per_100g": "41.4mg (230% DV)",
      "bioavailability_notes": "Non-heme iron; pair with vitamin C for better absorption"
    }
  ],
  "synergies": [
    {
      "target_ingredient": "black pepper",
      "type": "synergy",
      "description": "Piperine increases curcumin bioavailability by 2000% by inhibiting glucuronidation"
    },
    {
      "target_ingredient": "olive oil",
      "type": "synergy",
      "description": "Fat-soluble curcuminoids require dietary fat; olive oil provides its own anti-inflammatory oleocanthal"
    },
    {
      "target_ingredient": "ginger",
      "type": "complement",
      "description": "Complementary anti-inflammatory mechanisms: ginger targets COX-2, turmeric targets NF-kB"
    }
  ],
  "last_updated": "2026-04-12T00:00:00Z",
  "last_researched": "2026-04-12T00:00:00Z",
  "research_status": "complete"
}
